title,link,date,article
Worst than March 2020? Bitcoin price dives below $33K,https://cointelegraph.com/news/worst-than-march-2020-bitcoin-price-dives-below-33k,19-May,"This website is using a security service to protect itself from online attacks.
Cloudflare Ray ID: 6520ed7cfeff03d4
•
Your IP: 184.146.151.169
•
Performance & security by Cloudflare
"
"Ark's Cathie Wood Predicts Bitcoin Could Hit $500,000, Says Correction Is Good for ETF Approval",https://u.today/arks-cathie-wood-predicts-bitcoin-could-hit-500000-says-correction-is-good-for-etf-approval,19-05,"In a recent interview with Bloomberg's Carol Massar, Ark Invest CEO Cathie Wood predicted that Bitcoin would still reach $500,000, sticking to her earlier target in spite of the ongoing sell-off.The superstar fund manager claims that Ark's conviction ""remains high"" when it comes to Bitcoin:We go through soul-searching times like this but our conviction on Bitcoin remains high.Wood says that the recent correction has boosted the chances of a Bitcoin exchange-traded fund being approved by the U.S. Securities and Exchange Commission since such a product is less likely to be greenlit when prices are at all-time highs.Earlier today, Bitcoin careened to nearly $30,000.In addition, the 65-year-old investor has weighed in on the Elon Musk debacle, speculating that he was pressured by shareholders like BlackRock to reverse course on Bitcoin. However, she expects him to come back to the community:I believe what happened is after he took a position on Bitcoin, he got pushback from institutional shareholders like BlackRock. You've got Larry Fink beating drum on climate change. I don't think he expected that. But I think he'll come back to the mix.RelatedElon Musk Says Tesla Has Diamond Hands, Pushing Bitcoin Sharply Higher Ark Invest is heavily invested both in the Tesla stock and in the shares of Grayscale Bitcoin Trust (GBTC).Alex Dovbnya (aka AlexMorris) is a cryptocurrency expert, trader and journalist with extensive experience of covering everything related to the burgeoning industry — from price analysis to Blockchain disruption. Alex authored more than 1,000 stories for U.Today, CryptoComes and other fintech media outlets. He’s particularly interested in regulatory trends around the globe that are shaping the future of digital assets, can be contacted at alex.dovbnya@u.today.Alex Dovbnya (aka AlexMorris) is a cryptocurrency expert, trader and journalist with extensive experience of covering everything related to the burgeoning industry — from price analysis to Blockchain disruption. Alex authored more than 1,000 stories for U.Today, CryptoComes and other fintech media outlets. He’s particularly interested in regulatory trends around the globe that are shaping the future of digital assets, can be contacted at alex.dovbnya@u.today.Disclaimer: Any financial and market information given on U.Today is written for informational purpose only. Conduct your own research by contacting financial experts before making any investment decisions."
Bought The Dip: Justin Sun Buys $150 Million Worth of Bitcoin,https://cryptopotato.com/bought-the-dip-justin-sun-buys-150-million-worth-of-bitcoin/,19-05,"Justin Sun, the CEO of TRON, has announced a massive purchase of 4,145 bitcoins for $152,818,183 at an average price of $36,868.Justin Sun, the founder of TRON, just announced that he purchased over $150 million worth of bitcoins at an average price of about $36,800.I have bought 4145 #Bitcoin with $152,818,183 at average price $36,868.— Justin Sun  (@justinsuntron) May 19, 2021
											Varun is a writer and computer scientist. He enjoys looking at how cryptocurrencies are reshaping the way the world thinks about economics & finance. You'll most likely find him either studying or gambling on DeFi contracts.  Contact: LinkedIn
 Sign-up FREE to receive our extended weekly market update and coin analysis report"
"How Justin Sun Almost Caused Ethereum To Drop Below $1,500",https://www.newsbtc.com/news/ethereum/justin-sun-almost-ethereum-drop/,05-20,"Image by: Julius Drost - UnsplashAfter a display of strength in the past weeks, Ethereum dropped below $2,000 for a brief moment. The cryptocurrency seems to be recovered, but the crypto market could still face some resistance to return to its pre-crash levels.A report by Wu Blockchain claims that ETH’s price barely escaped from a bigger fall. Data provided by Philippe Castonguay shows that Justin Sun, CEO at the Tron Foundation, has a $1 billion position on the Ethereum-based Liquity Protocol.This 606,000 ETH position was almost liquidated and, due to its size, could have caused the price to crashed below $1,500 or $1,000 approximately. Castonguay said:There was about a 2 minute window where Liquity Protocol went into recovery mode and Justin Sun’s $1B dollar position could’ve been liquidated, but it didn’t happen. He just rebalanced his Trove 5 minutes ago, paying $300m back of debt.However, Castonguay later clarified that the protocol’s liquidation mechanism would have prevented ETH’s price from plunging. Liquity operates with entities called stability providers. Once a position is liquidated a 0.5% percent goes to the liquidators and 9.5% is distributed to every stability provider. Castonguay added:His ETH would’ve been purchased by the Stability Providers at *market price*. Buyers would’ve met seller at the same spot price.JustinSun said in Chinese community: Like a bullet passing through the scalp, I saved the cryptocurrency… https://t.co/vG7GTeoeKF pic.twitter.com/FRMmaExnuq— Wu Blockchain (@WuBlockchain) May 19, 2021Sun took advantage of the drop in Bitcoin and Ethereum’s price. Via his Twitter account, he announced two major BTC and ETH purchases. He made the announcement in the same fashion as major corporations have disclosed their crypto holdings.For the former, Sun claimed to have bought 4,145 BTC at an average price of $36,868 for an estimated $152 million. Sun said:I have bought many on a dip today, this is only my #BTC purchase. Keep BUIDLING, buy the DIP.The second purchase was made for 54,153 ETH at an average price of $2,509 for an estimated $135 million. Quoting MicroStrategy’s CEO, Michael Saylor, Sun said: “I’m not selling”.At the time of writing, ETH trades at $2,621 with a 21.6% loss in the daily chart. In the weekly chart ETH has a 37.1% dropped and in the monthly chart maintains a 17.2% profit.While the recovery has been impressive, the market might not be out of the woods. Data provided by Analyst Material Scientist on May 17th predicted a pullback on ETH against BTC. As the chart below shows, ETH had a retracement on this pair and could see further volatility in the coming days.Moreover, ETH and the rest of the market seem to have increased their level of correlation with Bitcoin, as it usually happens when any major price action occurs. In that sense, Material Scientists also expect BTC price to move sideways at current levels, at least, until June.
NewsBTC is a cryptocurrency news service that covers bitcoin news today, technical analysis & forecasts for bitcoin price and other altcoins. Here at NewsBTC, we are dedicated to enlightening everyone about bitcoin and other cryptocurrencies.We cover BTC news related to bitcoin exchanges, bitcoin mining and price forecasts for various cryptocurrencies.Auto Trading Software ▸ © 2020 NewsBTC. All Rights Reserved. © 2020 NewsBTC. All Rights Reserved."
Bitcoin Plummets 30% as “Extreme Fear” Sets in on Crypto Markets,https://bitcoinist.com/bitcoin-plummets-30-as-extreme-fear-sets-on-crypto-markets/,05-20,"The Crypto Fear and Greed Index, a metric that’s known to measure current market sentiment, fell to its lowest point of 2021. The index, which has continued to fall alongside Bitcoin prices, hit “extreme fear” levels, which have not been observed since April 2020 during the global financial market crash. The metric has continued to reflect the bearish sentiment that seems to have overtaken the crypto markets. As Bitcoin extended its losses and briefly hit $31,600 today, the indicator collapsed to a record-low rating of 11. News of Tesla rejecting Bitcoin payments earlier last week turned the markets sour — leading to a massive broad market drawdown. At time of writing, Bitcoin is down 27.63% in a single week, with Ethereum, Binance Coin and Dogecoin down 41.83%, 50.32%, and 26.60%, respectively. Just earlier last month, the metric signalled that the crypto market was heavily overheated, with a rating of 73, or “Greed.” Up to that point, Bitcoin was up by more than 200% YTD. Short-term volatility also climbed to the highest level seen since last February. According to the Bitcoin Volatility Index, monthly volatility rose to 4.64%. Unfortunately, it’s likely that volatility is here to stay. According to Deribit Metrics, historical volatility for the options market surged to 131%, up from 67% just a week prior. The contract with the highest notional value and volume are May 28 50,000 puts, which are already in-the-money. With more than $1.6 billion worth of contracts set to expire by the end of May, there’s no doubt that Bitcoin will continue to face choppy price action.For updates and exclusive offers enter your email.
Bitcoin news portal providing breaking news, guides, price analysis about decentralized digital money & blockchain technology.© 2021 Bitcoinist. All Rights Reserved."
VeChain (VET) verifies results of a 305 metric tonne plastic clean-up in the ocean,https://cryptoslate.com/vechain-vet-verifies-results-of-a-305-metric-tonne-plastic-clean-up-in-the-ocean/,05-20,"Earn up to 12% APY on Bitcoin, Ethereum, USD, EUR, GBP, Stablecoins & more.The blockchain found usage in verifiably tracing the results of an ecological project.ReSea Project, a Danish company with a community-driven solution to remove plastic from oceans and rivers in Indonesia, shared their Cleanup Impact Status on Linkedin yesterday, stating they cleared 305 metric tonnes of plastic waste from the ocean and verified the results using VeChain.“Our collection data from January-April 2021 is now verified by DNV and we are happy to share with you that we’ve removed 305.239,62 kg (672,938.17 lbs) of plastic waste from oceans and rivers,” they said in the post.VeChain’s ‘ToolChain platform’ traced the clean-up process, tracking plastic waste from the extraction point, how it was sorted, and when it was delivered at a local waste bank.The platform, based on blockchain technology, secures real-time data and records all the steps within the scope of certification. This enables DNV to digitally monitor and audit all plastic collections at all times, notifying all of the involved parties of any irregularities.The ReSea project is only the second in the world certified to the DNV’s Chain of Custody Standard for Plastics Retrieved in the Hydrosphere. The standard requirements assure the traceability and integrity of reclaimed plastic from any body of water. DNV is an expert assurance and risk management company that issued the first-ever traceability standard for verifying the authenticity and origin of the recovered ocean and river plastic.The certification helps push forward the cleanup efforts in Indonesia, the world’s second-largest contributor to ocean plastic pollution. As an independent third party, DNV also ensures fair compensation to cleanup teams, as people from local communities in Indonesia are employed to remove plastic waste from rivers and oceans.With a community-driven solution, ReSea is improving living conditions and raising awareness in areas with poor waste management. The high level of transparency into the collection process enables businesses to trust their involvement has an environmental and social impact.According to the Center for Biological diversity, the world is currently witnessing a global tragedy for our oceans and sea life. Accumulating plastic found in floating garbage patches already make up about 40 percent of the world’s ocean surfaces and at current rates, plastic is expected to outweigh all the fish in the sea by 2050.Besides reducing plastic consumption and improving waste management, large-scale cleanup solutions are crucial in mitigating the plastic pollution crisis. And seems like blockchain can help with that.  Access more crypto insights and context in every article as a paid member of CryptoSlate Edge.On July 5th, 2018, in partnership with KALTENDIN, high-end Chinese clothing brand, Waltonchain introduced the WTC-Garment System– the world's first blockchain-based, clothing authenticity traceability system.Cardano (ADA) parent IOHK announced a partnership yesterday with Wyoming-based BeefChain.China’s largest insurance conglomerate by total assets handled, the People’s Insurance Company of China (PICC), has partnered with VeChain, blockchain-based information tracking and governance systems company, with the goal of digitally transforming the insurance industry, according to a press release.Commitment to Transparency: The author of this article is invested and/or has an interest in one or more assets discussed in this post. CryptoSlate does not endorse any project or asset that may be mentioned or linked to in this article. Please take that into consideration when evaluating the content within this article.Disclaimer: Our writers' opinions are solely their own and do not reflect the opinion of CryptoSlate. None of the information you read on CryptoSlate should be taken as investment advice, nor does CryptoSlate endorse any project that may be mentioned or linked to in this article. Buying and trading cryptocurrencies should be considered a high-risk activity. Please do your own due diligence before taking any action related to content within this article. Finally, CryptoSlate takes no responsibility should you lose money trading cryptocurrencies.Access more crypto insights in every article as a paid member of CryptoSlate Edge.A single Cardano (ADA) trade worth over $45 million was liquidated today as the token fell along with the rest of the crypto market, data from markets tool Bybt shows.Caitlin Long, the founder of crypto bank Avanti Bank and a leading blockchain advocate, took to Twitter yesterday to explain the market sell-off, linking it to stablecoin issuer Tether.Crypto traders woke up to $3.7 billion in liquidations today as the market saw a deep pullback, data from markets tool Bybt shows.You’d probably need no introduction for Tone Vays, perhaps one of the most well-known institutional traders-turned-crypto geeks who has been making public calls on Bitcoin for years.Zug, Switzerland, 20th May 2021 — Defi project deFIRE has announced a partnership with live market data aggregator Coin360.Got a story tip? Email [email protected]Disclaimer: By using this website, you agree to our Terms and Conditions and Privacy Policy. CryptoSlate has no affiliation or relationship with any coin, business, project or event unless explicitly stated otherwise. CryptoSlate is only an informational website that provides news about coins, blockchain companies, blockchain products and blockchain events. None of the information you read on CryptoSlate should be taken as investment advice. Buying and trading cryptocurrencies should be considered a high-risk activity. Please do your own diligence before making any investment decisions. CryptoSlate is not accountable, directly or indirectly, for any damage or loss incurred, alleged or otherwise, in connection to the use or reliance of any content you read on the site.© 2021 CryptoSlate. All rights reserved. Terms | Privacy"
Judge Delivers Blow to Ripple Over Foreign Discovery,https://u.today/judge-delivers-blow-to-ripple-over-foreign-discovery,05-20,"Magistrate Judge Sarah Netburn has denied Ripple’s motion to stop the U.S. Securities and Commission from sending Memorandum of Understanding (MoU) requests to foreign securities regulators.    

As reported by U.Today, Ripple claimed that such requests were meant to intimidate its foreign business partners, but the judge asserts that there is “no evidence” to suggest that they were issued “in bad faith.”   The defendants wanted to compel the SEC to use the slow and inefficient Hague Convention process, but Netburn says that the MoU requests are permissible:   There has been no argument that the Requests exceed the scope of any governing bilateral agreement. Instead, courts have routinely rejected the proposition that the Hague Convention is the exclusive or priority means of conducting foreign discovery.     The SEC has to produce all documents obtained through its MoU requests, but it can withhold privileged ones from production.Last month, the agency revealed that three foreign counterparts had refused to provide any assistance. RelatedRipple Announces Partnership with Egypt's Largest BankThe ruling on foreign requests is Ripple’s first major setback in discovery fights.   

In April, the judge partially granted Ripple’s motion to compel the discovery of documents related to XRP, Bitcoin, and Ethereum. However, earlier this month, she clarified that Ripple cannot get access to the SEC staff’s personal emails.

In addition, CEO Brad Garlinghouse and co-founder Chris Larsen successfully blocked the SEC’s requests for their personal banking records.

The SEC is now trying to compel Ripple to produce the legal advice it “sought or received” regarding XRP’s regulatory status, which would help it to strike the defendants' “fair notice” defense.Alex Dovbnya (aka AlexMorris) is a cryptocurrency expert, trader and journalist with extensive experience of covering everything related to the burgeoning industry — from price analysis to Blockchain disruption. Alex authored more than 1,000 stories for U.Today, CryptoComes and other fintech media outlets. He’s particularly interested in regulatory trends around the globe that are shaping the future of digital assets, can be contacted at alex.dovbnya@u.today.Alex Dovbnya (aka AlexMorris) is a cryptocurrency expert, trader and journalist with extensive experience of covering everything related to the burgeoning industry — from price analysis to Blockchain disruption. Alex authored more than 1,000 stories for U.Today, CryptoComes and other fintech media outlets. He’s particularly interested in regulatory trends around the globe that are shaping the future of digital assets, can be contacted at alex.dovbnya@u.today.Disclaimer: Any financial and market information given on U.Today is written for informational purpose only. Conduct your own research by contacting financial experts before making any investment decisions."
Elon Musk Hints Dogecoin May Reach $1,https://u.today/elon-musk-hints-dogecoin-may-reach-1,05-20,"Elon Musk has just taken to Twitter to talk DOGE again, posting a picture of a $1 note with a Shiba-Inu dog on it, suggesting this is his forecast of the meme-coin's price. The picture in the tweet refers to the Cyber Viking book series by Marcus Sloss.The books are about Saudi war veteran Eric Yang, who prepares to save the Earth from an alien attack. Recalling Musk calling Doge the ""people's currency,"" it is easy to assume that the eccentric billionaire is again shilling DOGE as the asset that will ""save the world"" without the world realizing it yet.The asteroid barreling toward Earth is an alien spacecraft with hostile intent. Eric scrambles to plan, consolidate, and form his team while the rest of an oblivious society is prevented from vital information.At press time, Dogecoin is changing hands at $0.3752, as per CoinMarketCap, after yesterday's plunge followed Bitcoin's downward trajectory from above $40,000 down by $10,000.Related$5.28B in Stablecoins Moved to Exchanges Followed by 19,639 BTC Withdrawn As Market Grabs Bitcoin Dip The Tesla CEO is a long-term DOGE fan. He often posts tweets related to DOGE and pushing the coin's price to new highs. Many believe the head of Tesla is manipulating the Doge and Bitcoin price after he recently pushed BTC into the sea of red by tweeting that it is a ""dirty coin.""However, Musk's recent appearance on SNL made the meme-currency show a massive drop.Yuri is a crypto journalist interested in technology and technical innovations. He has been in crypto since 2017. Believes that blockchain and cryptocurrencies have a potential to transform the world in the future in many of its aspects. ‘Hodls’ major cryptocurrencies and has written for multiple crypto media outlets. 
His articles have been quoted by such crypto influencers as Tyler Winklevoss, John McAfee, CZ Binance, Max Keiser, etc.
Currently Yuri is a news writer at U.Today and can be contacted at yuri.molchan@u.today.
Yuri is a crypto journalist interested in technology and technical innovations. He has been in crypto since 2017. Believes that blockchain and cryptocurrencies have a potential to transform the world in the future in many of its aspects. ‘Hodls’ major cryptocurrencies and has written for multiple crypto media outlets. His articles have been quoted by such crypto influencers as Tyler Winklevoss, John McAfee, CZ Binance, Max Keiser, etc.Currently Yuri is a news writer at U.Today and can be contacted at yuri.molchan@u.today.Disclaimer: Any financial and market information given on U.Today is written for informational purpose only. Conduct your own research by contacting financial experts before making any investment decisions."
"Bitcoin Back to $42K, Nearly Recovering All of Wednesday's Losses",https://www.coindesk.com/bitcoin-42k-recovers-losses,05-20,"Sign up for our newslettersBy signing up, you will receive emails about CoinDesk products and you agree to our terms & conditions and privacy policySign up for our newslettersBy signing up, you will receive emails about CoinDesk products and you agree to our terms & conditions and privacy policyPlease consider using a different web browser for better experience.That didn't take long: Bitcoin is already back to where it was at the start of Wednesday, just before the biggest sell-off in 14 months. Bitcoin (BTC) jumped 15% Thursday, recovering nearly all of the ground lost during the yesterday’s price plunge.As of press time, the largest cryptocurrency was changing hands around $42,500. That’s roughly where it started on Wednesday, just before a 14% sell-off over the ensuing 24 hours – the biggest single-day decline since March 2020. Prices nearly fell below $30,000 at one point.   Ether (ETH), the second-largest cryptocurrency, was also on the mend Thursday, up 20% to about $2,931 at press time. The price tumbled 28% over the course of Wednesday, briefly dipping below $2,000.Other cryptocurrencies joined in the rebound. All of the free-floating cryptocurrencies in the CoinDesk 20 were up over the past 24 hours, with cardano (ADA) jumping some 69% to $1.92. Bitcoin cash (BCH) surged 57% to $845.Wednesday’s spot market volume was one for the record books, according to CoinMarketCap. Some $131.1 billion in bitcoin changed hands, nearly $5 billion more than Tuesday’s figure and nearly double the dollar volume of March 12, 2020, the “Black Thursday” of crypto. However, it should be noted that bitcoin was trading at one-fifth its current price at that point. Thus, when measured on a bitcoin volume basis, March 2020’s sell-off was far worse.Bitcoin’s market dominance, a measure of its market cap relative to the total for all other cryptocurrencies, briefly fell below 40% on Wednesday for the first time since June 2018.Also read: Ark Investment’s Cathie Wood Says Bitcoin Will Go to $500,000Ether also saw record volume in trading, with close to $93.5 billion of the cryptocurrency finding new owners Wednesday.The decentralized finance (DeFi) market was still feeling the heat from this week’s crypto market correction. The total amount of assets locked in DeFi is just above $65 billion, down from an all-time high of $88 billion on May 11, according to data site DeFiPulse.com. Despite the rough stretch, cryptocurrencies are still trouncing almost all other asset classes this year. Bitcoin is up around 44% year to date while ether has quadrupled in price. Sign up for our newslettersBy signing up, you will receive emails about CoinDesk products and you agree to our terms & conditions and privacy policyThe leader in news and information on cryptocurrency, digital assets and the future of money, CoinDesk is a media outlet that strives for the highest journalistic standards and abides by a strict set of editorial policies. CoinDesk is an independent operating subsidiary of Digital Currency Group, which invests in cryptocurrencies and blockchain startups."
