title,link,date,article
Judge Delivers Blow to Ripple Over Foreign Discovery,https://u.today/judge-delivers-blow-to-ripple-over-foreign-discovery,20-05,"Magistrate Judge Sarah Netburn has denied Ripple’s motion to stop the U.S. Securities and Commission from sending Memorandum of Understanding (MoU) requests to foreign securities regulators.    

As reported by U.Today, Ripple claimed that such requests were meant to intimidate its foreign business partners, but the judge asserts that there is “no evidence” to suggest that they were issued “in bad faith.”   The defendants wanted to compel the SEC to use the slow and inefficient Hague Convention process, but Netburn says that the MoU requests are permissible:   There has been no argument that the Requests exceed the scope of any governing bilateral agreement. Instead, courts have routinely rejected the proposition that the Hague Convention is the exclusive or priority means of conducting foreign discovery.     The SEC has to produce all documents obtained through its MoU requests, but it can withhold privileged ones from production.Last month, the agency revealed that three foreign counterparts had refused to provide any assistance. RelatedRipple Announces Partnership with Egypt's Largest BankThe ruling on foreign requests is Ripple’s first major setback in discovery fights.   

In April, the judge partially granted Ripple’s motion to compel the discovery of documents related to XRP, Bitcoin, and Ethereum. However, earlier this month, she clarified that Ripple cannot get access to the SEC staff’s personal emails.

In addition, CEO Brad Garlinghouse and co-founder Chris Larsen successfully blocked the SEC’s requests for their personal banking records.

The SEC is now trying to compel Ripple to produce the legal advice it “sought or received” regarding XRP’s regulatory status, which would help it to strike the defendants' “fair notice” defense.Alex Dovbnya (aka AlexMorris) is a cryptocurrency expert, trader and journalist with extensive experience of covering everything related to the burgeoning industry — from price analysis to Blockchain disruption. Alex authored more than 1,000 stories for U.Today, CryptoComes and other fintech media outlets. He’s particularly interested in regulatory trends around the globe that are shaping the future of digital assets, can be contacted at alex.dovbnya@u.today.
Alex Dovbnya (aka AlexMorris) is a cryptocurrency expert, trader and journalist with extensive experience of covering everything related to the burgeoning industry — from price analysis to Blockchain disruption. Alex authored more than 1,000 stories for U.Today, CryptoComes and other fintech media outlets. He’s particularly interested in regulatory trends around the globe that are shaping the future of digital assets, can be contacted at alex.dovbnya@u.today.Disclaimer: Any financial and market information given on U.Today is written for informational purpose only. Conduct your own research by contacting financial experts before making any investment decisions."
Elon Musk Hints Dogecoin May Reach $1,https://u.today/elon-musk-hints-dogecoin-may-reach-1,20-05,"Elon Musk has just taken to Twitter to talk DOGE again, posting a picture of a $1 note with a Shiba-Inu dog on it, suggesting this is his forecast of the meme-coin's price. The picture in the tweet refers to the Cyber Viking book series by Marcus Sloss.The books are about Saudi war veteran Eric Yang, who prepares to save the Earth from an alien attack. Recalling Musk calling Doge the ""people's currency,"" it is easy to assume that the eccentric billionaire is again shilling DOGE as the asset that will ""save the world"" without the world realizing it yet.The asteroid barreling toward Earth is an alien spacecraft with hostile intent. Eric scrambles to plan, consolidate, and form his team while the rest of an oblivious society is prevented from vital information.At press time, Dogecoin is changing hands at $0.3752, as per CoinMarketCap, after yesterday's plunge followed Bitcoin's downward trajectory from above $40,000 down by $10,000.Related$5.28B in Stablecoins Moved to Exchanges Followed by 19,639 BTC Withdrawn As Market Grabs Bitcoin Dip The Tesla CEO is a long-term DOGE fan. He often posts tweets related to DOGE and pushing the coin's price to new highs. Many believe the head of Tesla is manipulating the Doge and Bitcoin price after he recently pushed BTC into the sea of red by tweeting that it is a ""dirty coin.""However, Musk's recent appearance on SNL made the meme-currency show a massive drop.Yuri is a crypto journalist interested in technology and technical innovations. He has been in crypto since 2017. Believes that blockchain and cryptocurrencies have a potential to transform the world in the future in many of its aspects. ‘Hodls’ major cryptocurrencies and has written for multiple crypto media outlets. 
His articles have been quoted by such crypto influencers as Tyler Winklevoss, John McAfee, CZ Binance, Max Keiser, etc.
Currently Yuri is a news writer at U.Today and can be contacted at yuri.molchan@u.today.
Yuri is a crypto journalist interested in technology and technical innovations. He has been in crypto since 2017. Believes that blockchain and cryptocurrencies have a potential to transform the world in the future in many of its aspects. ‘Hodls’ major cryptocurrencies and has written for multiple crypto media outlets. His articles have been quoted by such crypto influencers as Tyler Winklevoss, John McAfee, CZ Binance, Max Keiser, etc.Currently Yuri is a news writer at U.Today and can be contacted at yuri.molchan@u.today.Disclaimer: Any financial and market information given on U.Today is written for informational purpose only. Conduct your own research by contacting financial experts before making any investment decisions."
"Bitcoin Back to $42K, Nearly Recovering All of Wednesday's Losses",https://www.coindesk.com/bitcoin-42k-recovers-losses,20-05,"Sign up for our newslettersBy signing up, you will receive emails about CoinDesk products and you agree to our terms & conditions and privacy policySign up for our newslettersBy signing up, you will receive emails about CoinDesk products and you agree to our terms & conditions and privacy policyPlease consider using a different web browser for better experience.That didn't take long: Bitcoin is already back to where it was at the start of Wednesday, just before the biggest sell-off in 14 months. Bitcoin (BTC) jumped 15% Thursday, recovering nearly all of the ground lost during the yesterday’s price plunge.As of press time, the largest cryptocurrency was changing hands around $42,500. That’s roughly where it started on Wednesday, just before a 14% sell-off over the ensuing 24 hours – the biggest single-day decline since March 2020. Prices nearly fell below $30,000 at one point.   Ether (ETH), the second-largest cryptocurrency, was also on the mend Thursday, up 20% to about $2,931 at press time. The price tumbled 28% over the course of Wednesday, briefly dipping below $2,000.Other cryptocurrencies joined in the rebound. All of the free-floating cryptocurrencies in the CoinDesk 20 were up over the past 24 hours, with cardano (ADA) jumping some 69% to $1.92. Bitcoin cash (BCH) surged 57% to $845.Wednesday’s spot market volume was one for the record books, according to CoinMarketCap. Some $131.1 billion in bitcoin changed hands, nearly $5 billion more than Tuesday’s figure and nearly double the dollar volume of March 12, 2020, the “Black Thursday” of crypto. However, it should be noted that bitcoin was trading at one-fifth its current price at that point. Thus, when measured on a bitcoin volume basis, March 2020’s sell-off was far worse.Bitcoin’s market dominance, a measure of its market cap relative to the total for all other cryptocurrencies, briefly fell below 40% on Wednesday for the first time since June 2018.Also read: Ark Investment’s Cathie Wood Says Bitcoin Will Go to $500,000Ether also saw record volume in trading, with close to $93.5 billion of the cryptocurrency finding new owners Wednesday.The decentralized finance (DeFi) market was still feeling the heat from this week’s crypto market correction. The total amount of assets locked in DeFi is just above $65 billion, down from an all-time high of $88 billion on May 11, according to data site DeFiPulse.com. Despite the rough stretch, cryptocurrencies are still trouncing almost all other asset classes this year. Bitcoin is up around 44% year to date while ether has quadrupled in price. Sign up for our newslettersBy signing up, you will receive emails about CoinDesk products and you agree to our terms & conditions and privacy policyThe leader in news and information on cryptocurrency, digital assets and the future of money, CoinDesk is a media outlet that strives for the highest journalistic standards and abides by a strict set of editorial policies. CoinDesk is an independent operating subsidiary of Digital Currency Group, which invests in cryptocurrencies and blockchain startups."
"Vitalik Buterin Says There's ""Big Risk"" That Bitcoin Will Get Left Behind",https://u.today/vitalik-buterin-says-theres-big-risk-that-bitcoin-will-get-left-behind,20-05,"Ethereum co-founder Vitalik Buterin told CNN Thursday that there is ""a big risk"" of Bitcoin being left behind if its technology does not evolve from where it is today:If Bitcoin sticks with its technology exactly as it is today, there's a big risk it will get left behind.In addition, he predicted that there is a chance of Ethereum surpassing the market cap of Bitcoin, fueling the flippening narrative.The youngest cryptocurrency billionaire said that concerns surrounding the power-hungry proof of work (PoW) algorithm are ""definitely real"":The resource consumption is definitely huge. It's not the sort of thing that's going to break the world by itself, but it's definitely a significant downside.As reported by U.Today, Ethereum is expected to reduce its power consumption by an estimated 99.95 percent after transitioning to the proof of stake (PoS) consensus algorithm.RelatedVitalik Buterin Just Burned $6 Billion Worth of Dogecoin Rival Shiba InuHot on the heels of the Wednesday market meltdown, Buterin stated that crypto is ""definitely"" in a bubble but he could not predict when it would end:It could have ended already. It could end months from now.Canine meme coins have become the embodiment of the current bubble, but Buterin does not want a piece of the action.

After burning $6.7 billion worth of Shiba Inu (SHIB) tokens, the 27-year-old Russian-Canadian programmer reiterated his request not to send him any tokens without his consent:First of all, I don't really know or understand many of these projects well. So, I can't endorse them.Alex Dovbnya (aka AlexMorris) is a cryptocurrency expert, trader and journalist with extensive experience of covering everything related to the burgeoning industry — from price analysis to Blockchain disruption. Alex authored more than 1,000 stories for U.Today, CryptoComes and other fintech media outlets. He’s particularly interested in regulatory trends around the globe that are shaping the future of digital assets, can be contacted at alex.dovbnya@u.today.
Alex Dovbnya (aka AlexMorris) is a cryptocurrency expert, trader and journalist with extensive experience of covering everything related to the burgeoning industry — from price analysis to Blockchain disruption. Alex authored more than 1,000 stories for U.Today, CryptoComes and other fintech media outlets. He’s particularly interested in regulatory trends around the globe that are shaping the future of digital assets, can be contacted at alex.dovbnya@u.today.Disclaimer: Any financial and market information given on U.Today is written for informational purpose only. Conduct your own research by contacting financial experts before making any investment decisions."
BREAKING: Bitcoin Drops Below $40K as Biden Administration Goes After Crypto,https://u.today/breaking-bitcoin-drops-below-40k-as-biden-administration-goes-after-crypto,20-05,"The United States Department of the Treasury is calling for cryptocurrency transfers that exceed $10,000 to be reported by businesses to the Internal Revenue Service starting from 2023, Bloomberg reports: As with cash transactions, businesses that receive cryptoassets with a fair-market value of more than $10,000 would also be reported on. The new initiative is part of the Biden administration's revamped tax enforcement plan.    The Treasury warned about “significant” tax evasion risks linked to the new asset class in its proposal.

The Biden administration is also seeking to double the IRS staff with $80 billion in additional funding, according to the Wall Street Journal. Fox Business contributor Charles Payne claims that the current administration is going after crypto in a tweet: Just when you thought President Biden wants $80 billion for an army of IRS agents to go after the rich - the administration looking to double staff to go after crypto.  Bitcoin has dropped six percent on the news, dipping below the $40,000 level.Alex Dovbnya (aka AlexMorris) is a cryptocurrency expert, trader and journalist with extensive experience of covering everything related to the burgeoning industry — from price analysis to Blockchain disruption. Alex authored more than 1,000 stories for U.Today, CryptoComes and other fintech media outlets. He’s particularly interested in regulatory trends around the globe that are shaping the future of digital assets, can be contacted at alex.dovbnya@u.today.
Alex Dovbnya (aka AlexMorris) is a cryptocurrency expert, trader and journalist with extensive experience of covering everything related to the burgeoning industry — from price analysis to Blockchain disruption. Alex authored more than 1,000 stories for U.Today, CryptoComes and other fintech media outlets. He’s particularly interested in regulatory trends around the globe that are shaping the future of digital assets, can be contacted at alex.dovbnya@u.today.Disclaimer: Any financial and market information given on U.Today is written for informational purpose only. Conduct your own research by contacting financial experts before making any investment decisions."
"Bitcoin (BTC) Peak: Wyckoff Distribution, 2013 Bull Run and Pi Cycle",https://beincrypto.com/bitcoin-btc-peak-wyckoff-distribution-2013-bull-run-and-pi-cycle/,20-05,"We use cookies to improve your experience.Lost or forgotten your password? Please enter your email ddress. You will receive mail with link to set new password.Analysts point out that bitcoin's peak had the form of Wyckoff distribution.The ongoing correction on the BTC market resembles 2013.Pi Cycle Top correctly predicted the (local) bull market peak.Free Cloud Mining Providers to Mine Bitcoin in 2021 The cryptocurrency market has experienced a strong shock in recent days, culminating in bitcoin’s flash crash to $30,000 yesterday. 

While looking for the reasons for this extremely bearish price action, the cryptocurrency community saw several technical indicators and patterns that could be heralds of what was about to happen.One of them is the Wyckoff distribution. This pattern is used in traditional financial markets to describe the peak of a bull market (distribution) or the bottom of a bear market (accumulation).

The interpretation by YouTube user @uncomplication, who compared the BTC price action from the last few months to the Wyckoff distribution, was particularly insightful. The most interesting fact is that the YouTuber published his analysis on April 25, 24 days before yesterday’s crash.It is also worth recalling the signal that the community received about a month ago from the Pi Cycle Top indicator and the deepening fear on the market, which reached the extremely low value of 11 points. The Fear and Greed Index has recorded such extreme readings only 5 times in its history.The Wyckoff diagram is a pattern in technical analysis that has gained popularity in the analysis of traditional financial markets. Its creator was Richard Wyckoff (1873-1934), a famous investor in the stock markets and creator of Magazine of Wall Street. He is one of the pioneers of modern technical analysis.A typical Wyckoff pattern consists of a series of sharp up and down price movements that create some elongated distribution. One of the tops of the diagram is the peak for this period of price action followed by an accelerated decline.Wyckoff distribution pattern / Source: school.stockcharts.comTo get the most out of the Wyckoff diagram, it needs to be identified correctly. This is done using trading ranges, price volatility, and trading volume. Following this identification, the appropriate buying/selling decisions can be made. The main principle here is gradual selling during the distribution period and gradual purchasing during the accumulation period, which is approximately the opposite of the distribution pattern.Over the past 24 hours, many members of the crypto community have drawn attention to the similarities in the bitcoin price action over the past few months to the Wyckoff distribution pattern. Most of them referred to the almost prophetic video by @uncomplication. He diagnosed this pattern almost a month ago.For example, the cryptocurrency trader @KingThies posted a juxtaposition of two variations of the Wyckoff distribution with a linear bitcoin chart on Twitter. He highlighted the key levels of the trading range, resistance, support, and the main phases of the distribution itself.Source: TwitterAlso, crypto market analyst Benjamin Cowen published an analysis of the potential Wyckoff pattern in the context of his prediction of an intermediate peak in this bitcoin bull run. He argues that whether it results from a realized distribution or a mere reaction to an overheated market, many signals indicated that the ongoing run could significantly improve correction.Source: YouTubeKnown for using mathematical analysis tools, Cowen has repeatedly compared the current bull market to the price action from two cycles ago. During this period, bitcoin’s exponential increase led to a deeper correction. It then continued its upward move to a new all-time high set a few months later.This idea about the similarities between the current cycle and the 2013-2014 period seems to also be supported by the well-known investor and bitcoin bull Raoul Pal. In a tweet today, he published a chart that compares the bitcoin price from these two bull markets. As it turns out, the similarities are indeed visible.Source: TwitterHowever, it was not only the Wyckoff distribution that turned out to be a harbinger of the coming drop. It is also worth mentioning the Pi Cycle Top indicator, which BeInCrypto wrote about during its recent intersection.In retrospect, it turned out that it had predicted the (local) top of the bull run very accurately again. Despite many not believing it on the day it crossed. This simple indicator is based on the movements of two curves: twice the 350-day DMA and the 111-day DMA.Their last intersection took place on April 12, just 2 days before the all-time high at $64,895.BTC chart by TradingviewInterestingly, a few days later, the curves made another intersection. Also, today they are again far apart at around $2,500. This means that if the market is to bounce soon and the bullish sentiment returns, the indicator would again be ready to point to a potential peak.Finally, pay attention to the behavior of the Fear and Greed Index. It is currently at its lowest levels since the COVID-19 crisis. Today, when market sentiment responds to yesterday’s crash, its value has dropped to 11/100.Current readings of the Fear and Greed Index / Source: alternative.meThis is an extremely low level of the indicator.  Such a low rating has only been recorded only 5 times since its inception (orange circles).Historical readings of the Fear and Greed Index / Source: alternative.meExtremely negative sentiment in the crypto market may indicate that the correction is not over yet. Any possible consolidation may take months. However, this indicator should be a good suggestion for new investors that now is the right time to consider taking positions with much lower risk compared to a month ago. PhD and an assistant professor at an international university in Lublin, Poland. Spent 10 years studying philosophy of nature and sport science. An author of 4 books and two dozens of scientific articles. Now, he is using his mind for the benefits of the cryptocommunity. Technical analysis enthusiast, Bitcoin warrior, and a strong supporter of the idea of decentralization. Duc in altum!Join our Telegram Group and get trading signals, a free trading course and daily communication with crypto fans!Join Our TelegramStay tuned with daily newsletters that make reading the news simple and enjoyable Crypto predictions with the Best Telegram Signal with +70% accuracy! Free Cloud Mining Providers to Mine Bitcoin in 2021 Market signals, studies and analysis! Join our Telegram Today! Fat Pig Signals"
Elon Musk Says He Won’t Sell Any of His Dogecoin Holdings,https://u.today/elon-musk-says-he-wont-sell-any-of-his-dogecoin-holdings,20-05,"It turns out that Elon Musk has diamond hands as well. 

The Tesla CEO has just tweeted that he doesn't plan to sell any of his Dogecoin holdings in his response to YouTuber Dave Lee. Earlier today, Musk posted a one-dollar bill with Shiba Inu, implying that the meme cryptocurrency could reach the much-coveted price mark. Dogecoin is currently trading at $0.39 on the Binance exchange.RelatedCardano Creator Wants to Help Elon Musk Fix DogecoinThe billionaire also said that Tesla had ""diamond hands"" because of CFO Zach ""Master of Coin"" Kirkhorn in a May 19 tweet, pushing Bitcoin significantly higher during a brutal sell-off.  The e-car manufacturer still holds Bitcoin on its balance sheet despite no longer accepting it as a means of payment due to environmental concerns.     Alex Dovbnya (aka AlexMorris) is a cryptocurrency expert, trader and journalist with extensive experience of covering everything related to the burgeoning industry — from price analysis to Blockchain disruption. Alex authored more than 1,000 stories for U.Today, CryptoComes and other fintech media outlets. He’s particularly interested in regulatory trends around the globe that are shaping the future of digital assets, can be contacted at alex.dovbnya@u.today.
Alex Dovbnya (aka AlexMorris) is a cryptocurrency expert, trader and journalist with extensive experience of covering everything related to the burgeoning industry — from price analysis to Blockchain disruption. Alex authored more than 1,000 stories for U.Today, CryptoComes and other fintech media outlets. He’s particularly interested in regulatory trends around the globe that are shaping the future of digital assets, can be contacted at alex.dovbnya@u.today.Disclaimer: Any financial and market information given on U.Today is written for informational purpose only. Conduct your own research by contacting financial experts before making any investment decisions."
