title,link,date,article
3 reasons why Bitcoin price struggles to reclaim $64K,https://cointelegraph.com/news/3-reasons-why-bitcoin-price-struggles-to-reclaim-64k?utm_source=CryptoNews&utm_medium=app,"21 June 2024 23:55, UTC-",
Document Reveals Ripple Plans to Sell Only 25B XRP for Operations and Profit,https://thecryptobasic.com/2024/06/21/document-reveals-ripple-plans-to-sell-only-25b-xrp-for-operations-and-profit/?utm_source=CryptoNews&utm_medium=app,"21 June 2024 12:59, UTC-","[ccpw id=""39382""]Date: Written By: Follow Us OnThe XRP Army recently unearthed a document revealing that Ripple intends to liquidate only a quarter of the XRP supply and distribute the balance for further development.The report, authored by three Ripple employees from the markets and business development departments and Roman Leal from Goldman Sachs, reveals that Ripple intends to retain 25% of the total XRP supply.Ripple highlighted that only 100 billion XRP tokens will ever be issued based on the network’s design, and it plans to retain 25% of the total issued assets to fund its operations and generate a profit.This means Ripple schedules to keep a reserve of 25 billion XRP, presently valued at approximately $12.5 billion for company use.Notably, Ripple’s sales of XRP have been in force for years and will continue for the next few years. Amid these sales, the company now holds about 4.87 billion XRP in spendable balance and 39.5 billion in escrow. This puts its XRP reserve at over 44.36 billion tokens.Before the firm secured 55 billion XRP in escrow in 2017, it held 61.68 billion in spendable wallets. With around 44.36 billion XRP left, this implies that Ripple has liquidated over 17 billion XRP over the years.Meanwhile, the document suggests that Ripple plans to distribute the remaining 75% of XRP’s supply to incentivize market makers, gateways, and consumers to use its Ripple protocol. Essentially, 75 billion XRP tokens are up for funding further XRP ecosystem development.By doing so, the company aims to create a demand chain that should increase XRP’s value, given its finite supply. Currently, 55,618,185,850 XRP are in circulation.It is worth noting that this document was published in November 2014, just a few years after the inception of the company. Pro-XRP X user SMQKE called attention to the paper in a recent post.Ripple does not plan on selling all of its XRP. They plan to retain 25% of their XRP to turn a profit and further fund its own operations. The rest is distributed to incentivize the participation of market makers/gateways to UTILIZE THE PROTOCOL ✅“As Demand grows PRICE ⬆️” https://t.co/Rc5dCkvrfA pic.twitter.com/ih0vHDfsWH— SMQKE (@SMQKEDQG) June 20, 2024 This revelation has sparked reactions from community members. Some have dismissed its relevance given that it is a decade old, suggesting the likelihood of Ripple deviating from the proposition in the document.Disclaimer: This content is informational and should not be considered financial advice. The views expressed in this article may include the author's personal opinions and do not reflect The Crypto Basic’s opinion. Readers are encouraged to do thorough research before making any investment decisions. The Crypto Basic is not responsible for any financial losses.-Advertisement-AuthorMore from AuthorCopyright ©The Crypto Basic."
BREAKING:  Game-changing Bitcoin and Ethereum Step Has Come from Standard Chartered! They Are Launching a Spot Trading Desk,https://en.bitcoinsistemi.com/breaking-game-changing-bitcoin-and-ethereum-step-has-come-from-standard-chartered-they-are-launching-a-spot-trading-desk/?utm_source=CryptoNews&utm_medium=app,"21 June 2024 08:57, UTC-","
                                Türkçe bir sürüm mevcut.
                            
                                Bitcoinsistemi'nin Türkçe sürümüne gitmek ister misiniz?
                            According to breaking news, Bloomberg reported that Standard Chartered has launched a spot crypto trading desk for Bitcoin and Ethereum.According to sources familiar with the matter, Standard Chartered is establishing a spot trading desk for Bitcoin and Ethereum.The new crypto desk, which is on the verge of becoming operational, will be integrated into the bank's foreign exchange (FX) trading unit. Sources, who did not want their names to be disclosed while sharing confidential information, announced that the desk will be operated from London.Historically, banks such as Goldman Sachs have been involved in trading assets such as cryptocurrencies. However, strict regulations prevented these banks from dealing directly with the underlying assets. The Basel Committee on Banking Supervision has suggested that banks should apply a 1,250% risk weight to any unhedged crypto exposure that creates difficulty generating profits.“We are working closely with our regulators to support demand from our institutional customers to trade Bitcoin and Ethereum, and are aligned with our strategy to support customers across the wider digital asset ecosystem, from access and custody to tokenization and interoperability,” Standard Chartered said in an official statement.*This is not investment advice.ΔΔCheck your inbox or spam to confirm your subscription.
         Bitcoin NewsEthereum NewsCrypto AnalyticsBitcoin PriceLive Cryptocurrency DataCrypto DictionaryOur TeamAboutPrivacyBusiness PartnersAdvertisementContactRisk Disclosure: Guides, news, articles and analyzes on Bitcoinsistemi.com do not constitute investment advice. Keeping in mind that Bitcoin and cryptocurrencies are high-risk products, you should do your own research for each investment decision. Otherwise, you may come to the point of losing your entire investment. In this context, you should know that you are responsible for the losses that may arise from all your transfers and transactions.Bitcoinsistemi.com is a news site, does not provide investment advice and does not recommend investing in any projects or digital assets. In this context, the content and content authors on Bitcoinsistemi.com cannot be held responsible for the investment decisions you make.© Copyright 2023Türkçe bir sürüm mevcut.Bitcoinsistemi'nin Türkçe sürümüne gitmek ister misiniz?"
"Bitcoin falls close to $64,000 as ETFs bleed $140 million",https://cryptobriefing.com/bitcoin-etf-outflows-impact/?utm_source=CryptoNews&utm_medium=app,"21 June 2024 07:27, UTC-","Join the hunt for $12,000,000+ in NEXO Tokens!Share this articleBitcoin’s price plunged close to $64,000 on Friday, hitting a low of $64,300, according to data from TradingView. The drop followed major withdrawals from US spot Bitcoin ETFs, totaling $139.88 million on Thursday.Grayscale Bitcoin Trust (GBTC) saw $53 million in its daily net outflows, while Fidelity Wise Origin Bitcoin Fund (FBTC) recorded $51 million in outflows, according to SoSoValue’s data.Bitwise Bitcoin ETF experienced $32 million in outflows, while VanEck Bitcoin Trust and Invesco Galaxy Bitcoin ETF saw outflows of $4 million and $2 million, respectively.In contrast, BlackRock’s iShares Bitcoin Trust enjoyed $1.5 million in inflows. There were no flows in ARK 21Shares Bitcoin ETF (ARKB), Franklin Templeton Bitcoin ETF (EZBC), and WisdomTree Physical Bitcoin (BTCW) during the day’s trading session.The latest record marked the fifth consecutive day of losses for US spot Bitcoin ETFs, though this is not the most extended. The longest streak of outflows occurred from April 24 to May 2, resulting in a $1.2 billion reduction.Historically, Bitcoin’s price actions have reflected ETF flows. However, over the past few weeks, numerous factors have taken turns.According to Arkham Intelligence, the recent selling pressure could come from the German government, which has transferred approximately $195 million in Bitcoin to exchanges since June 19. Data shows that the government still holds around $3 billion worth of BTC.UPDATE: German Government Still Selling BTC > $195M So Far.In the past 2 hours, the German Government sent $65M in BTC to 2 likely exchange deposits including Coinbase.The German Government moved $600M BTC yesterday, sending $130M BTC to 4 likely exchange deposits including… pic.twitter.com/in2urlDBE0— Arkham (@ArkhamIntel) June 20, 2024Another factor to consider is hedge funds’ exposure to BTC. According to André Dragosch, Head of Research at ETC Group, hedge funds have reduced their market exposure to a mere 0.37 over the last 20 trading days, a low not seen since October 2020.BOOM: Crypto hedge funds have really thrown in the towel on #Bitcoin lately. They have reduced their $BTC market exposure to only 0.37 over the past 20 trading days. 👀Lowest since October 2020. pic.twitter.com/WZCRK9QlMG— André Dragosch | Bitcoin & Macro ⚡ (@Andre_Dragosch) June 19, 2024Macroeconomic factors, including the Federal Reserve’s (Fed) stance on interest rates, could also affect the market, with cuts unlikely until later this year. The Fed said it needed more data to be confident that inflation is on track to its 2% target.Bitcoin’s bearish momentum could be aggravated by those factors. At the time of writing, Bitcoin is trading at around $64,500, down almost 8% in a month.Share this articleDon’t have an account? Create oneAlready have an account? Sign InSign In"
Solana ETF in the works: 3iQ files for new ETP in Canada,https://cointelegraph.com/news/3iq-files-solana-etf-canada?utm_source=CryptoNews&utm_medium=app,"20 June 2024 22:26, UTC-",
"BlackRock, Fidelity, JPMorgan Dominate Real-World Assets Tokenization Trend",https://beincrypto.com/blackrock-fidelity-jpmorgan-real-world-assets-rwa-tokenization/?utm_source=CryptoNews&utm_medium=app,"20 June 2024 20:12, UTC-",
macOS of blockchains? Solana captures 60% of new DEX volume in May,https://cointelegraph.com/news/mac-os-blockchain-solana-captures-60-new-dex-volume-may?utm_source=CryptoNews&utm_medium=app,"20 June 2024 18:20, UTC-",
“People can access me 24/7:” Bitwise Ethereum ad pokes fun at traditional finance,https://cryptobriefing.com/ethereum-bitwise-ad-contrast/?utm_source=CryptoNews&utm_medium=app,"20 June 2024 15:27, UTC-","Join the hunt for $12,000,000+ in NEXO Tokens!Share this articleAsset manager Bitwise released a commercial today comparing Ethereum (ETH) and traditional finance in a joking tone. With the caption “Unlike Big Finance, Ethereum doesn’t clock out at 4 p.m.”, the commercial portrays traditional finance as a senior and tired man, while Ethereum is a more jovial and full of energy version.Unlike Big Finance, Ethereum doesn't clock out at 4 p.m. pic.twitter.com/0gCJi3wlXp— Bitwise (@BitwiseInvest) June 20, 2024The character representing Ethereum shows surprise when the character portraying the traditional finance market says he’s “gone for the day” after “working non-stop since 9:30 a.m.” He adds that Ethereum would be tired too if it “moved billions around the world.”“Actually, I do. You know, stablecoins, NFTs, loans. People can access me 24/7,” says the character portraying Ethereum, and traditional finance shows surprise at that statement. Additionally, the commercial also jokes about the fact that traditional finance markets don’t work on weekends.As reported by Crypto Briefing, Bitwise has revised its Form S-1 registration statement for its spot Ether (ETH) exchange-traded fund (ETF), highlighting a potential $100 million investment upon its launch.Moreover, the SEC filing indicates that Pantera Capital Management has shown interest in purchasing up to $100 million of shares in this Ether ETF. However, these indications are not binding commitments, leaving open the possibility of purchasing more, fewer, or no shares at all.Notably, the spot Ether ETFs could start trading in the US within two weeks, as shared by Bloomberg ETF analyst Eric Balchunas on June 14th.Share this articleDon’t have an account? Create oneAlready have an account? Sign InSign In"
XRP Investors Cry Foul Over SEC’s Ethereum Favoritism,https://coinedition.com/xrp-investors-cry-foul-over-secs-ethereum-favoritism/?utm_source=CryptoNews&utm_medium=app,"19 June 2024 10:03, UTC-",
Circle USDC Stablecoin May Be The Biggest Beneficiary Under New European Guidelines,https://coincu.com/264378-circle-usdc-stablecoin-biggest-beneficiary/?utm_source=CryptoNews&utm_medium=app,"19 June 2024 09:59, UTC-","Signup for our newsletter to get notified about sales and new products. Add any text here or remove it.Error: Contact form not found.BTC$64224.696ETH$3487.683BNB$586.47XRP$0.487LIVE UPDATESKey Points:Kaiko analyst Anastasia Melachrinos highlighted that USDC could capture market share from its larger competitor, Tether’s USDT, particularly as traders use stablecoins to move digital assets between exchanges or to store wealth amid volatile token prices.The regulatory shift is already influencing major crypto exchanges. OKX has curtailed trading support for USDT in the European Union, although users can still deposit, withdraw, conduct over-the-counter transactions, and exchange USDT for euros. Similarly, Kraken is reviewing plans that might include delisting USDT under the new EU regulations, known as MiCA (Markets in Crypto-Assets).“For sure Kraken and OKX are going to delist all the EURO/USDT pairs,” Melachrinos noted during a conference call.MiCA will be fully implemented by early 2025, with the European Banking Authority overseeing the rules on stablecoins. Issuers of asset-referenced and e-money tokens will need to hold a license from a national financial authority by June 30 and meet stringent requirements on corporate governance, conflicts of interest, and reserve management, including maintaining a third of all funds at an independent credit institution.Meanwhile, Circle USDC stablecoin faces regulatory scrutiny from the U.S. Securities and Exchange Commission (SEC) as it pursues a multi-billion dollar initial public offering (IPO).The SEC has expressed concerns over classifying USDC as a security, which previously stalled Circle’s attempt to go public via a special-purpose acquisition company (SPAC) in 2021. Circle has addressed most of the SEC’s issues but continues to navigate the regulatory landscape as it seeks approval for its IPO.CircleCircle USDC StablecoinKrakenMiCAOKXSECStablecoinUSDC HaroldKey Points:Kaiko analyst Anastasia Melachrinos highlighted that USDC could capture market share from its larger competitor, Tether’s USDT, particularly as traders use stablecoins to move digital assets between exchanges or to store wealth amid volatile token prices.The regulatory shift is already influencing major crypto exchanges. OKX has curtailed trading support for USDT in the European Union, although users can still deposit, withdraw, conduct over-the-counter transactions, and exchange USDT for euros. Similarly, Kraken is reviewing plans that might include delisting USDT under the new EU regulations, known as MiCA (Markets in Crypto-Assets).“For sure Kraken and OKX are going to delist all the EURO/USDT pairs,” Melachrinos noted during a conference call.MiCA will be fully implemented by early 2025, with the European Banking Authority overseeing the rules on stablecoins. Issuers of asset-referenced and e-money tokens will need to hold a license from a national financial authority by June 30 and meet stringent requirements on corporate governance, conflicts of interest, and reserve management, including maintaining a third of all funds at an independent credit institution.Meanwhile, Circle USDC stablecoin faces regulatory scrutiny from the U.S. Securities and Exchange Commission (SEC) as it pursues a multi-billion dollar initial public offering (IPO).The SEC has expressed concerns over classifying USDC as a security, which previously stalled Circle’s attempt to go public via a special-purpose acquisition company (SPAC) in 2021. Circle has addressed most of the SEC’s issues but continues to navigate the regulatory landscape as it seeks approval for its IPO.
Related Posts





MicroStrategy Bitcoin Investments Helps Company Reach $6.33 Billion in Profit





SEC Leans Toward Spot Ethereum ETF Approval: Report





Ripple’s XRP Sale Worth $78 Million Is Putting Great Pressure on Token Prices





Is DWF Labs Market Manipulation Being Covered By Binance, Or Is There An Important Secret?





Bitcoin Bridge Nomic Approved Soon by Osmosis DAO To Facilitate Fee-Free BTC Transfers





Uniswap Interface Fees Will Be Refunded $8 Million By PancakeSwap





Vitalik Buterin Advocates for Decentralized Protocol for Asset Transfers Across Layer 2 Network





Bitcoin Hedge Fund Net Shorts Set New Record High Amid Positive Bitcoin ETF


     News  - 16 hours ago 2 mins Spot Ethereum ETF Applicants Updated S-1 Forms, Raising Launch Expectations      Knowledge  - 161 days ago 12 mins Crypto To Crypto Converter: Detailed Guide For Beginners And Important Notes      Knowledge  - 108 days ago 13 mins Free Bitcoin Code 2024: Easy Way To Own Bitcoin      Knowledge  - 161 days ago 12 mins Fiat To Fiat Converter: Detailed Guide For Beginners And Important Notes      News  - 14 hours ago 2 mins Vietnamese Cybercrime Group Indicted in US for $71M Crypto Hacking Scheme      Knowledge  - 96 days ago 10 mins Buy Dogecoin on eToro: Step-by-Step Guide for Beginners (2024)      Knowledge  - 62 days ago 12 mins Bitcoin Mining: How Long Does It Take to Mine 1 Bitcoin?      News  - 15 hours ago 2 mins Consensys SEC Lawsuit Continues to Clarify Crypto Regulations  News  Knowledge  Knowledge  Knowledge  News  Knowledge  Knowledge  News      News  - 2 days ago 2 mins Binance Launches USDT Integration with Toncoin Network for Fast Transactions!      News  - 16 hours ago 2 mins Spot Ethereum ETF Applicants Updated S-1 Forms, Raising Launch Expectations      News  - 1 days ago 2 mins LayerZero’s Daily Transaction Volume Crashes Over 97% from Peak!      News  - 14 hours ago 2 mins Vietnamese Cybercrime Group Indicted in US for $71M Crypto Hacking Scheme      News  - 2 days ago 2 mins Donald Trump Election Campaign Receives $2M Bitcoin Donation From Gemini  News  News  News  News  News      News  - 7 days ago 2 mins LayerZero Token Airdrop Rules Announced, Early Transactions Will Be Eewarded 3x      News  - 8 days ago 2 mins VanEck Bitcoin ETF Will Launch in Australia on June 20      News  - 8 days ago 3 mins Ethereum ETF S-1 Expected To Be Approved By July 2      News  - 5 days ago 3 mins zkSync Token Airdrop Is Now Causing Controversy With Unequal Allocation to ZeroLend      News  - 2 days ago 2 mins Binance Launches LayerZero (ZRO) and Add Seed Tags!  News  News  News  News  News      Analysis  - 26 days ago 6 mins Everyone Is An Analyst: Recommend 7 Free On-chain Data Analysis Tools      Top Projects  - 26 days ago 18 mins Top 5 Cross-Chain Bridges In Crypto      News  - 25 days ago 3 mins Can Bitcoin Solve US Debt Crisis? Trump’s Surprising Inquiry      News  - 15 days ago 3 mins Ripple’s XRP Sale Worth $78 Million Is Putting Great Pressure on Token Prices      News  - 9 days ago 2 mins Bitcoin Whale Wallets With Over 1,000 BTC Are Almost At A New All Time High  Analysis  Top Projects  News  News  News Join, Enjoy and
Earn in Our Space

© 2021 - 2023 COINCU Financial Group Inc. All rights reserved."
Circle Snags First Stablecoin License Under EU's New MiCA Rules,https://www.coindesk.com/business/2024/07/01/stablecoin-issuer-circle-snags-mica-compliant-emi-license-for-europe/?utm_source=CryptoNews&utm_medium=app,"01 July 2024 15:30, UTC-","Circle became the first global stablecoin issuer to secure an Electronic Money Institution (EMI) license, a prerequisite to offering dollar- and euro-pegged crypto tokens in the European Union (EU) under the Markets in Crypto Assets (MiCA) regulatory framework.The license gives the company, whose USDC trails behind rival Tether's market-leading USDT, pole position in grabbing market share among the 27-nation trading bloc's 450 million people.Stablecoins are a key piece of infrastructure in the digital asset market, facilitating trading on exchanges and, increasingly, used for transactions and remittances. Circle's $32 billion USDC is the second-largest stablecoin and the gap to market leader Tether's $110 billion USDT has been widening.Armed with a license from the French banking regulatory authority, Circle Mint France will “onshore” the issuance of its euro-denominated EURC stablecoin to the EU and issue USDC from the same entity, the company said. Before MiCA's stablecoin rules took effect on June 30, some crypto exchanges delisted euro-denominated stablecoins, such as Tether’s EURT.MiCA’s comprehensive stance on stablecoins was catalyzed by the specter of big tech, like Meta's Diem (formerly Libra) initiative, entering financial markets. That prompted five years of concerted policy development in Europe, said Circle’s head of policy, Dante Disparte, who was involved in the Libra project.“Personally, I feel a little bit of a semi-parental relationship with MiCA because in some ways it was accelerated by my prior life and my prior project, Libra Diem,” Disparate said in an interview. “MiCA is both vindicating of the industry and its permanence, but it's also clear that there is no more shortcuts, at least not in the third-largest economy in the world. Gone are the days where you could operate in a regulatory haven or in the shadows and then expect to have liberal and free access to consumers and market participants.”Read more: EU's Restrictive Stablecoin Rules Take Effect Soon and Issuers Are Running Out of TimeUPDATE (July 1, 15:15 UTC): Adds stablecoin utility, relative market caps of USDC, USDT in third paragraph.Edited by Sheldon Reback.DisclosurePlease note that our privacy policy, terms of use, cookies, and do not sell my personal information has been updated.CoinDesk is an award-winning media outlet that covers the cryptocurrency industry. Its journalists abide by a strict set of editorial policies. In November 2023, CoinDesk was acquired by the Bullish group, owner of Bullish, a regulated, digital assets exchange. The Bullish group is majority-owned by Block.one; both companies have interests in a variety of blockchain and digital asset businesses and significant holdings of digital assets, including bitcoin. CoinDesk operates as an independent subsidiary with an editorial committee to protect journalistic independence. CoinDesk employees, including journalists, may receive options in the Bullish group as part of their compensation.Ian Allison is an award-winning senior reporter at CoinDesk. He holds ETH.Krisztian Sandor is a reporter on the U.S. markets team focusing on stablecoins and institutional investment. He holds BTC and ETH.AboutStay UpdatedGet In TouchThe Fine PrintPlease note that our privacy policy, terms of use, cookies, and do not sell my personal information has been updated.CoinDesk is an award-winning media outlet that covers the cryptocurrency industry. Its journalists abide by a strict set of editorial policies. In November 2023, CoinDesk was acquired by the Bullish group, owner of Bullish, a regulated, digital assets exchange. The Bullish group is majority-owned by Block.one; both companies have interests in a variety of blockchain and digital asset businesses and significant holdings of digital assets, including bitcoin. CoinDesk operates as an independent subsidiary with an editorial committee to protect journalistic independence. CoinDesk employees, including journalists, may receive options in the Bullish group as part of their compensation.©2024 CoinDesk"
Bitcoin Price Prediction for July: WIll BTC Recover?,https://cryptopotato.com/bitcoin-price-prediction-for-july-will-btc-recover/?utm_source=CryptoNews&utm_medium=app,"01 July 2024 10:37, UTC-","Will Bitcoin’s price recover in July? Let’s have a look at this interesting price prediction. The month of June was a tumultuous one for the Bitcoin price as it brought quite a lot of volatility.Unfortunately, the price action was resolved to the downside, and the bears managed to push it down by 7.12%.Will July be different?With June behind our backs, it’s worth noting that Bitcoin went on a complete rollercoaster during the past 30 days, soaring to as much as $72,000 and dropping to a low of slightly more than $58,000.That said, the sellers were ultimately victorious, pushing the price down by about 7% in total.But will things change in July? Well, according to the popular analyst Ali Charts on X, July is traditionally a strong month for Bitcoin.Historically, when Bitcoin has had a negative June, it tends to bounce back strongly in July. In fact, BTC has shown an average return of 7.98% and a median return of 9.6% during this month.If the last hours are any indication of how the month will go, then the above seems to be true.Bitcoin’s price increased by 4% over the past day, currently trading at around $63,200. This has also pushed its weekly performance in the green by about 1.6%.Naturally, this has put many short positions underwater, with liquidations for the past 24 hours standing at $106 million, with around 85% of them being sellers.
											Georgi Georgiev is CryptoPotato's editor-in-chief and a seasoned writer with over four years of experience writing about blockchain and cryptocurrencies. Georgi's passion for Bitcoin and cryptocurrencies bloomed in late 2016 and he hasn't looked back since. Crypto’s technological and economic implications are what interest him most, and he has one eye turned to the market whenever he’s not sleeping. Contact George: LinkedIn
 Sign-up FREE to receive our extended daily market update and coin analysis report"
