title,link,date,article
Bitcoin Price Takes a Plunge: Analyzing the Sudden Drop,https://www.newsbtc.com/analysis/btc/bitcoin-price-plunge-62700/?utm_source=CryptoNews&utm_medium=app,"24 June 2024 04:33, UTC-","Bitcoin price started another decline after it struggled near $64,550. BTC declined below the $63,500 support and might continue to move down.Bitcoin price failed to recover above the $65,000 level. BTC struggled near $64,550 and started another decline. There was a steady decline below the $64,000 and $63,500 levels.The price even declined below the $63,000 level. A low was formed at $62,700 and the price is now consolidating losses. There is also a connecting bearish trend line forming with resistance at $63,600 on the hourly chart of the BTC/USD pair.Bitcoin is now trading below $63,500 and the 100 hourly Simple moving average. If there is a recovery wave, the price could face resistance near the $63,550 level and the 23.6% Fib retracement level of the downward move from the $66,444 swing high to the $62,700 low.The first major resistance could be $64,000. The next key resistance could be $64,500 or the 50% Fib retracement level of the downward move from the $66,444 swing high to the $62,700 low.A clear move above the $64,500 resistance might start a steady increase and send the price higher. In the stated case, the price could rise and test the $65,500 resistance. Any more gains might send BTC toward the $66,200 resistance in the near term.If Bitcoin fails to climb above the $63,550 resistance zone, it could continue to move down. Immediate support on the downside is near the $62,700 level.The first major support is $62,200. The next support is now forming near $62,000. Any more losses might send the price toward the $61,200 support zone in the near term.Technical indicators:Hourly MACD – The MACD is now gaining pace in the bearish zone.Hourly RSI (Relative Strength Index) – The RSI for BTC/USD is now below the 50 level.Major Support Levels – $62,700, followed by $62,200.Major Resistance Levels – $63,550, and $64,500.Aayush Jindal, a luminary in the world of financial markets, whose expertise spans over 15 illustrious years in the realms of Forex and cryptocurrency trading. Renowned for his unparalleled proficiency in providing technical analysis, Aayush is a trusted advisor and senior market expert to investors worldwide, guiding them through the intricate landscapes of modern finance with his keen insights and astute chart analysis.Aayush Jindal, a luminary in the world of financial markets, whose expertise spans over 15 illustrious years in the realms of Forex and cryptocurrency trading. Renowned for his unparalleled proficiency in providing technical analysis, Aayush is a trusted advisor and senior market expert to investors worldwide, guiding them through the intricate landscapes of modern finance with his keen insights and astute chart analysis.From a young age, Aayush exhibited a natural aptitude for deciphering complex systems and unraveling patterns. Fueled by an insatiable curiosity for understanding market dynamics, he embarked on a journey that would lead him to become one of the foremost authorities in the fields of Forex and crypto trading. With a meticulous eye for detail and an unwavering commitment to excellence, Aayush honed his craft over the years, mastering the art of technical analysis and chart interpretation.
As a software engineer, Aayush harnesses the power of technology to optimize trading strategies and develop innovative solutions for navigating the volatile waters of financial markets. His background in software engineering has equipped him with a unique skill set, enabling him to leverage cutting-edge tools and algorithms to gain a competitive edge in an ever-evolving landscape.In addition to his roles in finance and technology, Aayush serves as the director of a prestigious IT company, where he spearheads initiatives aimed at driving digital innovation and transformation. Under his visionary leadership, the company has flourished, cementing its position as a leader in the tech industry and paving the way for groundbreaking advancements in software development and IT solutions.Despite his demanding professional commitments, Aayush is a firm believer in the importance of work-life balance. An avid traveler and adventurer, he finds solace in exploring new destinations, immersing himself in different cultures, and forging lasting memories along the way. Whether he's trekking through the Himalayas, diving in the azure waters of the Maldives, or experiencing the vibrant energy of bustling metropolises, Aayush embraces every opportunity to broaden his horizons and create unforgettable experiences.Aayush's journey to success is marked by a relentless pursuit of excellence and a steadfast commitment to continuous learning and growth. His academic achievements are a testament to his dedication and passion for excellence, having completed his software engineering with honors and excelling in every department.At his core, Aayush is driven by a profound passion for analyzing markets and uncovering profitable opportunities amidst volatility. Whether he's poring over price charts, identifying key support and resistance levels, or providing insightful analysis to his clients and followers, Aayush's unwavering dedication to his craft sets him apart as a true industry leader and a beacon of inspiration to aspiring traders around the globe.In a world where uncertainty reigns supreme, Aayush Jindal stands as a guiding light, illuminating the path to financial success with his unparalleled expertise, unwavering integrity, and boundless enthusiasm for the markets.Disclaimer: The information found on NewsBTC is for educational purposes
							only. It does not represent the opinions of NewsBTC on whether to buy, sell or hold any
							investments and naturally investing carries risks. You are advised to conduct your own
							research before making any investment decisions. Use information provided on this website
							entirely at your own risk.
						In a recent commentary on X, Daniel Yan, co-founder of Matrixport and CIO at Kryptanium Capital, offered a detailed comparison...					
						Arthur Hayes, the co-founder of crypto exchange BitMEX, has recently offered a comprehensive analysis in his latest essay, “Zoom Out,”...					
						Bitcoin has been in a notable state of flux recently after recovering from the crash below $60,000 and establishing support...					Be the first to get the latest important crypto news & events to your inbox.ΔNewsBTC is a cryptocurrency news service that covers bitcoin news today, technical analysis & forecasts for bitcoin price and other altcoins. Here at NewsBTC, we are dedicated to enlightening everyone about bitcoin and other cryptocurrencies.We cover BTC news related to bitcoin exchanges, bitcoin mining and price forecasts for various cryptocurrencies. © 2024 NewsBTC. All Rights Reserved. © 2024 NewsBTC. All Rights Reserved."
