title,link,date,article
Bitcoin Falls After U.S. Sends $240M Worth of Silk Road-Related BTC to Coinbase,https://www.coindesk.com/markets/2024/06/26/bitcoin-falls-after-us-sends-240m-worth-of-silk-road-related-btc-to-coinbase/?utm_source=CryptoNews&utm_medium=app,"26 June 2024 17:55, UTC-","Bitcoin (BTC) fell back towards $60,000 on Wednesday, after a wallet tagged to the U.S. Government moved about $240 million worth of seized BTC to a Coinbase Prime address, igniting concerns among traders that the digital assets will likely to be sold.Some 3,940 bitcoin originally seized from a Silk Road vendor was moved by the the wallet, according to an Arkham Intelligence social media post. ""This BTC was originally seized from narcotics trafficker Banmeet Singh, and forfeited at trial in January 2024,"" the post said.The last movement by the government— which in late 2022 seized roughly 50,000 bitcoin related to the Silk Road website—was $2 billion worth of bitcoin on April 2, which at the time also put pressure on digital markets. The last confirmed sale by the government was in March 2023, when it unloaded 9,861 coins for $216 million.Attempting a modest bounce from its Mt. Gox-related tumble earlier this week, bitcoin slipped back below $61,000 as the news hit. It's since edged back to $61,100 down 1% over the past 24 hours, with the broader CoinDesk 20 Index lower by about the same amount. Ether {{EHT}} also slipped on the news, falling 1.6% on the day.Read more: Mt. Gox to Begin Repayments in July; BTC Slides Under $61KEdited by Stephen Alpher.DisclosurePlease note that our privacy policy, terms of use, cookies, and do not sell my personal information has been updated.CoinDesk is an award-winning media outlet that covers the cryptocurrency industry. Its journalists abide by a strict set of editorial policies. In November 2023, CoinDesk was acquired by the Bullish group, owner of Bullish, a regulated, digital assets exchange. The Bullish group is majority-owned by Block.one; both companies have interests in a variety of blockchain and digital asset businesses and significant holdings of digital assets, including bitcoin. CoinDesk operates as an independent subsidiary with an editorial committee to protect journalistic independence. CoinDesk employees, including journalists, may receive options in the Bullish group as part of their compensation.Aoyon Ashraf is managing editor with more than a decade of experience in covering equity marketsAboutStay UpdatedGet In TouchThe Fine PrintPlease note that our privacy policy, terms of use, cookies, and do not sell my personal information has been updated.CoinDesk is an award-winning media outlet that covers the cryptocurrency industry. Its journalists abide by a strict set of editorial policies. In November 2023, CoinDesk was acquired by the Bullish group, owner of Bullish, a regulated, digital assets exchange. The Bullish group is majority-owned by Block.one; both companies have interests in a variety of blockchain and digital asset businesses and significant holdings of digital assets, including bitcoin. CoinDesk operates as an independent subsidiary with an editorial committee to protect journalistic independence. CoinDesk employees, including journalists, may receive options in the Bullish group as part of their compensation.©2024 CoinDesk"
BlackRock Bitcoin ETF Surges with $1.1 Billion Trading Volume Today!,https://coincu.com/265249-blackrock-bitcoin-etf-surges-with-1-1-b-volume/?utm_source=CryptoNews&utm_medium=app,"26 June 2024 04:40, UTC-","Signup for our newsletter to get notified about sales and new products. Add any text here or remove it.Error: Contact form not found.BTC$62267.133ETH$3429.076BNB$577.631XRP$0.483LIVE UPDATESKey Points:It has emerged as a single-point agenda between institutional and retail investors for exposure to Bitcoin, managed by New York-based global investment giant BlackRock. The $1.1 billion trading volume mirrors robust market demand and substantial daily trading activity.Read more: BlackRock Bitcoin ETF Had Its First Outflows Since January 2024BlackRock Bitcoin ETFs have become famous protocols that investors can use to gain exposure to the digital currency’s price movements without directly owning Bitcoin. With its size and liquidity, BlackRock’s ETF has been a go-to instrument for investors looking to get in and out of the volatile cryptocurrency market.Its $1.1 billion trading volume underlines BlackRock’s leadership in the cryptocurrency investment scene. Its ETF not only exposes investors to Bitcoin but also reveals investor confidence and serves as an indicator of market sentiment toward digital assets.Bitcoin ETFBitcoin ETF InflowBlackrockBlackRock Bitcoin ETF AnnieKey Points:It has emerged as a single-point agenda between institutional and retail investors for exposure to Bitcoin, managed by New York-based global investment giant BlackRock. The $1.1 billion trading volume mirrors robust market demand and substantial daily trading activity.Read more: BlackRock Bitcoin ETF Had Its First Outflows Since January 2024BlackRock Bitcoin ETFs have become famous protocols that investors can use to gain exposure to the digital currency’s price movements without directly owning Bitcoin. With its size and liquidity, BlackRock’s ETF has been a go-to instrument for investors looking to get in and out of the volatile cryptocurrency market.Its $1.1 billion trading volume underlines BlackRock’s leadership in the cryptocurrency investment scene. Its ETF not only exposes investors to Bitcoin but also reveals investor confidence and serves as an indicator of market sentiment toward digital assets.
Related Posts





Market Overview (Jun 3 – Jun 9): Bitcoin ETFs Surge As Trump Fosters Crypto World





Missing Cryptoqueen Ruja Ignatova Wanted in US With New $5 Million Reward





Donald Trump Election Campaign Receives $2M Bitcoin Donation From Gemini





Worldcoin World ID Will Be Launched on Solana Soon





QCP Capital Predicts BTC to Hit 74K, Expects ETH to Outperform with New ETF!





Impersonated a16z Member Seized $245,000 in Crypto Scam





Binance ZK Listing Launched With Allocation of Additional 10.5 Million Tokens to Users





OKX Wallet Transactions Trigger Chaos, Costing Millions in Bitcoin Fees!


     Knowledge  - 117 days ago 13 mins Free Bitcoin Code 2024: Easy Way To Own Bitcoin      Knowledge  - 171 days ago 13 mins Crypto To Crypto Converter: Detailed Guide For Beginners And Important Notes      Knowledge  - 106 days ago 10 mins Buy Dogecoin on eToro: Step-by-Step Guide for Beginners (2024)      Knowledge  - 171 days ago 12 mins Fiat To Fiat Converter: Detailed Guide For Beginners And Important Notes      Uncategorized  - 420 days ago 11 mins Top 5 Gambling Projects Will Offer You The Most Attractive Benefits       Knowledge  - 72 days ago 13 mins Bitcoin Mining: How Long Does It Take to Mine 1 Bitcoin?      Casino Reviews  - 295 days ago 49 mins Top Bitcoin Casino Sites In 2024      Knowledge  - 78 days ago 21 mins Potential US Election Candidates 2024: Who Will Win?  Knowledge  Knowledge  Knowledge  Knowledge  Uncategorized  Knowledge  Casino Reviews  Knowledge      News  - 2 days ago 2 mins Joe Biden Presidential Campaign Is Being Supported by the Crypto Community to Quit      News  - 1 days ago 3 mins Solana Liquid Staking Sees Explosive Growth QOQ: Analysis      News  - 2 days ago 2 mins LayerZero Critical Vulnerability Denied Amid Allegations Questioning Protocol Design      News  - 8 hours ago 2 mins Polkadot Ecosystem Highly Toxic, Web3 Value Questioned!      News  - 1 days ago 2 mins Starknet Foundation DeFi Spring 2.0 Added 50 Million STRK To Boost The Ecosystem  News  News  News  News  News      News  - 7 days ago 2 mins BlackRock Bitcoin ETF Surges with $1.1 Billion Trading Volume Today!      News  - 6 days ago 3 mins Spot Ethereum ETF Approval Likely to Happen on July 4      Press Releases  - 7 days ago 5 mins PlayDoge ($PLAY) Achieves $5 Million Milestone in ICO, a Tamagotchi-Style Meme Coin      News  - 5 days ago 2 mins Worldcoin World ID Will Be Launched on Solana Soon      Sponsored Articles  - 5 days ago 4 mins Cardano (ADA), Ripple (XRP), And ETFSwap (ETFS) Are The Altcoins To Hold When Spot Bitcoin ETFs Inflow Return  News  News  Press Releases  News  Sponsored Articles      Knowledge  - 21 days ago 9 mins Save Up To 35% With Exclusive Cashback Trading Code From Coincu      News  - 19 days ago 2 mins Bitcoin Whale Wallets With Over 1,000 BTC Are Almost At A New All Time High      News  - 25 days ago 3 mins Ripple’s XRP Sale Worth $78 Million Is Putting Great Pressure on Token Prices      News  - 17 days ago 3 mins LayerZero Token Airdrop Rules Announced, Early Transactions Will Be Eewarded 3x      Knowledge  - 23 days ago 9 mins Vitalik Buterin Net Worth: 2024 Update  Knowledge  News  News  News  Knowledge Join, Enjoy and
Earn in Our Space

© 2021 - 2023 COINCU Financial Group Inc. All rights reserved."
BREAKING: A Bill to Allow the Payment of Federal Income Tax with Bitcoin in the US Has Been Introduced,https://en.bitcoinsistemi.com/breaking-a-bill-to-allow-the-payment-of-federal-income-tax-with-bitcoin-in-the-us-has-been-introduced/?utm_source=CryptoNews&utm_medium=app,"25 June 2024 15:58, UTC-","
                                Türkçe bir sürüm mevcut.
                            
                                Bitcoinsistemi'nin Türkçe sürümüne gitmek ister misiniz?
                            In the USA, Congressman Matt Gaetz introduced the bill allowing Federal Income Tax to be paid with Bitcoin.Florida's representative introduced a bill that would amend the Internal Revenue Code of 1986 to allow taxpayers to use Bitcoin to pay taxes.The proposed amendment authorizes the Treasury to “develop and implement a method that will allow any tax imposed on an individual to be paid in Bitcoin” under the stated title. This move could be a game-changer in increasing the adoption of cryptocurrencies in the United States.This innovative legislation is not just a minor adjustment to the existing Treasury law. It represents a significant shift in the government's approach to digital assets.*This is not investment advice.ΔΔCheck your inbox or spam to confirm your subscription.
         Bitcoin NewsEthereum NewsCrypto AnalyticsBitcoin PriceLive Cryptocurrency DataCrypto DictionaryOur TeamAboutPrivacyBusiness PartnersAdvertisementContactRisk Disclosure: Guides, news, articles and analyzes on Bitcoinsistemi.com do not constitute investment advice. Keeping in mind that Bitcoin and cryptocurrencies are high-risk products, you should do your own research for each investment decision. Otherwise, you may come to the point of losing your entire investment. In this context, you should know that you are responsible for the losses that may arise from all your transfers and transactions.Bitcoinsistemi.com is a news site, does not provide investment advice and does not recommend investing in any projects or digital assets. In this context, the content and content authors on Bitcoinsistemi.com cannot be held responsible for the investment decisions you make.© Copyright 2023Türkçe bir sürüm mevcut.Bitcoinsistemi'nin Türkçe sürümüne gitmek ister misiniz?"
Mt. Gox repayments won’t be as bad for Bitcoin as you think: Analysts,https://cointelegraph.com/news/mt-gox-bitcoin-dump-fear-concern-overblown-analysts?utm_source=CryptoNews&utm_medium=app,"25 June 2024 02:25, UTC-",
"The Expected Pro-Bitcoin Bill Becomes Law in the USA: Full Support for BTC, Ban on CBDCs!",https://en.bitcoinsistemi.com/the-expected-pro-bitcoin-bill-becomes-law-in-the-usa-full-support-for-btc-ban-on-cbdcs/?utm_source=CryptoNews&utm_medium=app,"24 June 2024 15:57, UTC-","
                                Türkçe bir sürüm mevcut.
                            
                                Bitcoinsistemi'nin Türkçe sürümüne gitmek ister misiniz?
                            The US state of Louisiana has passed a pro-Bitcoin bill.According to Forbes, the US state of Louisiana has passed a pro-Bitcoin bill.Accordingly, Louisiana passed a pro-Bitcoin bill to protect access to Bitcoin and block Central Bank Digital Currencies (CBDC), while Bitcoin rights became law in a second state.Louisiana governor Jeff Landry signed the pro-Bitcoin Bill 488 into law after receiving bipartisan approval from both the House of Representatives and the Senate.This legislation, sponsored by Representative Mark Wright and Senator Jean-Paul Coussan, supports making access to Bitcoin easier while placing restrictions on CBDCs.According to the provisions in the accepted draft law; The law in question ensures that individuals can hold their BTC safely, while also allowing businesses to spend and accept Bitcoin without legal barriers.The law also prohibits the state of Louisiana from accepting payments in CBDC while supporting Bitcoin mining in industrial areas to attract investment and strengthen the Louisiana economy.By banning CBDCs and encouraging Bitcoin adoption, Louisiana is creating a supportive environment for digital currencies in the US and aims to set an example for other states.*This is not investment advice.ΔΔCheck your inbox or spam to confirm your subscription.
         Bitcoin NewsEthereum NewsCrypto AnalyticsBitcoin PriceLive Cryptocurrency DataCrypto DictionaryOur TeamAboutPrivacyBusiness PartnersAdvertisementContactRisk Disclosure: Guides, news, articles and analyzes on Bitcoinsistemi.com do not constitute investment advice. Keeping in mind that Bitcoin and cryptocurrencies are high-risk products, you should do your own research for each investment decision. Otherwise, you may come to the point of losing your entire investment. In this context, you should know that you are responsible for the losses that may arise from all your transfers and transactions.Bitcoinsistemi.com is a news site, does not provide investment advice and does not recommend investing in any projects or digital assets. In this context, the content and content authors on Bitcoinsistemi.com cannot be held responsible for the investment decisions you make.© Copyright 2023Türkçe bir sürüm mevcut.Bitcoinsistemi'nin Türkçe sürümüne gitmek ister misiniz?"
JUST IN:  Mt.Gox Announced It Will Start Bitcoin (BTC) Payments!,https://en.bitcoinsistemi.com/just-in-mt-gox-announced-it-will-start-bitcoin-btc-payments/?utm_source=CryptoNews&utm_medium=app,"24 June 2024 08:57, UTC-","
                                Türkçe bir sürüm mevcut.
                            
                                Bitcoinsistemi'nin Türkçe sürümüne gitmek ister misiniz?
                            Mt.Gox trustee said he will start Bitcoin and Bitcoin Cash refunds.According to Bloomberg, Mt. Gox trustee said he will start Bitcoin (BTC) and Bitcoin Cash (BCH) refunds.The official statement made the following statements:“Notice on the Start of Bitcoin and Bitcoin Cash Refunds:The Board of Trustees is preparing to make repayments in Bitcoin and Bitcoin Cash within the scope of the Rehabilitation Plan.Now that these preparations have been made, the Rehabilitation Board of Trustees will begin issuing refunds in Bitcoin and Bitcoin Cash in accordance with the cryptocurrency exchanges where it has completed the exchange and approval of the information necessary for the implementation of the refunds.“Refunds will be made from the beginning of July 2024.”MTGOX KAYYUMU BITCOIN VE BITCOIN CASH GERI ÖDEMELERINE BAŞLAYACAĞINI SÖYLEDI: BBG— Bitcoin Sistemi (@bitcoinsistemi) June 24, 2024 *This is not investment advice.ΔΔCheck your inbox or spam to confirm your subscription.
         Bitcoin NewsEthereum NewsCrypto AnalyticsBitcoin PriceLive Cryptocurrency DataCrypto DictionaryOur TeamAboutPrivacyBusiness PartnersAdvertisementContactRisk Disclosure: Guides, news, articles and analyzes on Bitcoinsistemi.com do not constitute investment advice. Keeping in mind that Bitcoin and cryptocurrencies are high-risk products, you should do your own research for each investment decision. Otherwise, you may come to the point of losing your entire investment. In this context, you should know that you are responsible for the losses that may arise from all your transfers and transactions.Bitcoinsistemi.com is a news site, does not provide investment advice and does not recommend investing in any projects or digital assets. In this context, the content and content authors on Bitcoinsistemi.com cannot be held responsible for the investment decisions you make.© Copyright 2023Türkçe bir sürüm mevcut.Bitcoinsistemi'nin Türkçe sürümüne gitmek ister misiniz?"
Bitcoin's Double Top Suggests BTC Could Fall to $50K: Analyst,https://www.coindesk.com/markets/2024/06/24/bitcoins-double-top-suggests-btc-could-fall-to-50k-analyst/?utm_source=CryptoNews&utm_medium=app,"24 June 2024 07:34, UTC-","Bitcoin (BTC) has carved out a double-top price pattern, signaling a potential bearish trend change ahead of key data release that could influence the Fed's interest rate path.Bitcoin's price journey has been a rollercoaster this month. After surging to nearly $70,000, approaching the all-time high of March, it has now retreated to $63,000, decoupling from Nasdaq's continued move higher, largely due to faster selling by miners, profit-taking by investors near lifetime highs, and outflows from the U.S.-listed spot exchange-traded funds.The price action has formed a double top, a bearish technical analysis pattern comprising two peaks with a valley in the middle, usually appearing after a notable uptrend. The second peak represents uptrend exhaustion, with the eventual breach of the low hit between the two peaks confirming a bearish trend change.""Technically, bitcoin appears to follow a double top formation, whereas the support level is being tested. This chart formation should be our base case unless it becomes invalidated. This formation could easily see a drop to $50,000—if not $45,000,"" Markus Thielen, founder of 10x Research, said.""Yes, the U.S. election and CPI should be bullish later this year, but we can still have a steeper correction,"" Thielen added.However, the Fed's preferred inflation yardstick, the personal consumption expenditures (PCE) price index for May, is expected to show the slowest monthly advance in the core figure in over three years. That would cement the case for renewed Fed rate cuts from September, potentially putting a floor under risk assets, including bitcoin.""[Recent] Strong economic data has forced [bond] yields higher and precious metals lower on Friday. This continues to stand in the way of digital hard assets like crypto,"" Greg Magadini, director of derivatives at Amberdata, said in the weekly newsletter shared with CoinDesk.""This week we have multiple Fed Governors speaking, GDP and most importantly PCE on Friday (the Fed’s favorite inflation indicator),"" Magadini added.Economists surveyed by Bloomberg expect no change in the PCE price index and a meager 0.1% uptick in the core PCE, amounting to 2.6% annual advances in both the headline and core figures. The projected core increase, excluding food and energy, would be the smallest since March 2021.Edited by Parikshit Mishra.DisclosurePlease note that our privacy policy, terms of use, cookies, and do not sell my personal information has been updated.CoinDesk is an award-winning media outlet that covers the cryptocurrency industry. Its journalists abide by a strict set of editorial policies. In November 2023, CoinDesk was acquired by the Bullish group, owner of Bullish, a regulated, digital assets exchange. The Bullish group is majority-owned by Block.one; both companies have interests in a variety of blockchain and digital asset businesses and significant holdings of digital assets, including bitcoin. CoinDesk operates as an independent subsidiary with an editorial committee to protect journalistic independence. CoinDesk employees, including journalists, may receive options in the Bullish group as part of their compensation.Omkar Godbole is a Co-Managing Editor on CoinDesk's Markets team.AboutStay UpdatedGet In TouchThe Fine PrintPlease note that our privacy policy, terms of use, cookies, and do not sell my personal information has been updated.CoinDesk is an award-winning media outlet that covers the cryptocurrency industry. Its journalists abide by a strict set of editorial policies. In November 2023, CoinDesk was acquired by the Bullish group, owner of Bullish, a regulated, digital assets exchange. The Bullish group is majority-owned by Block.one; both companies have interests in a variety of blockchain and digital asset businesses and significant holdings of digital assets, including bitcoin. CoinDesk operates as an independent subsidiary with an editorial committee to protect journalistic independence. CoinDesk employees, including journalists, may receive options in the Bullish group as part of their compensation.©2024 CoinDesk"
